[
  {
    "service": "Animal Bite Treatment Center",
    "slug": "animal-bite-treatment-center",
    "type": "transaction",
    "description": "Anti-rabies vaccination and wound management for individuals bitten by animals.",
    "officeSlug": ["municipal-health-office"],
    "category": {
      "name": "Health & Wellness",
      "slug": "health-wellness"
    },
    "updatedAt": null,
    "quickInfo": {
      "processingTime": "Immediate",
      "appointmentType": "Walk-in (Urgent)"
    },
    "sources": []
  },
  {
    "service": "Cash Subsidy for Solo Parents",
    "slug": "solo-parents-cash-subsidy",
    "type": "transaction",
    "description": "Financial assistance provided semi-annually to qualified solo parents in the municipality.",
    "officeSlug": ["municipal-social-welfare-and-development-office"],
    "category": {
      "name": "Social Services",
      "slug": "social-services"
    },
    "steps": [
      "Register as a Solo Parent with the MSWDO.",
      "Submit required documents during the designated payout period.",
      "Receive cash subsidy (Php 1,000 per month or as allocated)."
    ],
    "requirements": [
      "Valid Solo Parent ID",
      "Barangay Certification of Residency",
      "Affidavit of Solo Parent status"
    ],
    "quickInfo": {
      "fee": "Free",
      "whoCanApply": "Registered Solo Parents",
      "documents": "Solo Parent ID"
    },
    "updatedAt": null,
    "sources": [
      {
        "name": "Republic Act No. 11861 (Expanded Solo Parents Welfare Act of 2022)"
      }
    ]
  },
  {
    "service": "Expanded Centenarian Program Payout (Ages 80, 85, 90, 95)",
    "slug": "expanded-centenarian-payout",
    "type": "transaction",
    "description": "Provision of cash incentives for elderly residents reaching milestone ages of 80, 85, 90, and 95, facilitated by the National Commission of Senior Citizens (NCSC).",
    "url": "",
    "officeSlug": ["municipal-treasurers-office"],
    "category": {
      "name": "Social Services",
      "slug": "social-services"
    },
    "steps": [
      "Verify if the senior's name is included in the official NCSC Masterlist (January to June 2025 batch).",
      "Secure required templates (Authorization, SPA, or Warranty & Release forms) from the OSCA Office between 8:00 AM and 5:00 PM.",
      "Prepare the specific set of documents based on the claimant's status (Personal, Representative, or Deceased).",
      "Proceed to the Municipal Treasury Office on the designated payout date and time.",
      "Submit documents for verification and receive the cash incentive."
    ],
    "requirements": [
      "FOR PERSONAL CLAIM: 2 copies of valid ID with signature or thumbmark.",
      "FOR REPRESENTATIVE: Authorization Letter (NCSC template), Physical ID of grantee (original + photocopy), Physical ID of claimant (original + photocopy).",
      "FOR REPRESENTATIVE (BEDRIDDEN): Barangay Certification signed by Captain and BHW or Medical Certificate.",
      "FOR REPRESENTATIVE (PROOF OF LIFE): Half-body photo of the grantee holding a current calendar or newspaper.",
      "FOR DECEASED GRANTEE: Special Power of Attorney (SPA template), Warranty and Release from Liability form, Original or CTC of Death Certificate, Claimant ID with 3 signatures, and Proof of Relationship."
    ],
    "faqs": [
      {
        "question": "Where can I get the SPA or Authorization templates?",
        "answer": "Templates are available at the Office of the Senior Citizens Affairs (OSCA) from 8:00 AM to 5:00 PM."
      },
      {
        "question": "Who is eligible for this specific payout?",
        "answer": "Seniors who are part of the qualified beneficiaries list from January to June 2025 provided by the NCSC."
      }
    ],
    "quickInfo": {
      "processingTime": "Scheduled Payout (Dec 18, 2025)",
      "fee": "Free",
      "whoCanApply": "Seniors aged 80, 85, 90, 95",
      "appointmentType": "Walk-in (Treasury Office)",
      "documents": "Valid IDs, SPA/Authorization, Proof of Life"
    },
    "updatedAt": "2026-01-13T20:44:00Z",
    "sources": [
      {
        "name": "National Commission of Senior Citizens (NCSC)",
        "url": "https://ncsc.gov.ph"
      },
      {
        "name": "Office of the Senior Citizens Affairs (OSCA) San Jose de Buenavista"
      }
    ]
  },
  {
    "service": "Fire Safety Inspection Certificate (FSIC)",
    "slug": "fire-safety-inspection-certificate",
    "type": "transaction",
    "description": "Required for occupancy and business permits to ensure the structure meets fire safety standards.",
    "officeSlug": ["bureau-fire-protection"],
    "category": {
      "name": "Public Safety",
      "slug": "public-safety"
    },
    "requirements": [
      "Unified Application Form",
      "Building Permit Number and Date Issued",
      "FSEC Number and Date Issued",
      "Site Inspection by BFP personnel"
    ],
    "quickInfo": {
      "processingTime": "3-5 days",
      "whoCanApply": "Building Owners / Business Operators"
    },
    "updatedAt": null,
    "sources": [
      {
        "name": "BFP Fire Safety Regulations"
      }
    ]
  },
  {
    "service": "Garbage Collection Schedule",
    "slug": "garbage-collection-schedule",
    "type": "information",
    "description": "Weekly schedule for waste collection per barangay. Please segregate biodegradable and non-biodegradable waste.",
    "officeSlug": ["municipal-environment-and-natural-resources-office"],
    "category": {
      "name": "Environment & Waste",
      "slug": "environment-waste"
    },
    "steps": [
      "Monday & Thursday: Batong Malake, San Antonio, Maahas (Biodegradable)",
      "Tuesday & Friday: Bayog, Mayondon, Malinta (Biodegradable)",
      "Wednesday: All Barangays (Non-Biodegradable / Recyclables)",
      "Saturday: Special collection for Market area",
      "Sunday: No Collection"
    ],
    "requirements": [
      "Please ensure waste is segregated before putting it out.",
      "Bring out trash only between 6:00 AM - 8:00 AM."
    ],
    "quickInfo": {
      "processingTime": "Weekly",
      "whoCanApply": "All Residents"
    },
    "updatedAt": null,
    "sources": [
      {
        "name": "Republic Act No. 9003 (Ecological Solid Waste Management Act)",
        "url": ""
      },
      {
        "name": "MENRO Garbage Collection Policy",
        "url": ""
      }
    ]
  },
  {
    "service": "Medical Assistance (AICS)",
    "slug": "medical-assistance-aics",
    "type": "transaction",
    "description": "Assistance to Individuals in Crisis Situations for medical needs.",
    "officeSlug": ["municipal-social-welfare-and-development-office"],
    "category": {
      "name": "Social Services",
      "slug": "social-services"
    },
    "steps": [
      "Submit requirements for screening.",
      "Undergo interview by Social Worker.",
      "Receive Guarantee Letter or Cash Assistance."
    ],
    "requirements": [
      "Medical Certificate / Abstract",
      "Hospital Bill / Prescription",
      "Barangay Certificate of Indigency",
      "Valid ID of claimant"
    ],
    "quickInfo": {
      "processingTime": "1-2 days",
      "whoCanApply": "Indigent Residents",
      "appointmentType": "Walk-in"
    },
    "updatedAt": null,
    "sources": [
      {
        "name": "DSWD Memorandum Circular No. 02 Series of 2014",
        "url": ""
      },
      {
        "name": "MSWDO Guidelines on Financial Assistance",
        "url": ""
      }
    ]
  },
  {
    "service": "Public School Directory",
    "slug": "public-school-directory",
    "type": "information",
    "description": "A comprehensive list of public elementary and secondary schools in the municipality.",
    "officeSlug": ["department-of-education"],
    "category": {
      "name": "Education & Scholarship",
      "slug": "education-scholarship"
    },
    "steps": [
      "San Jose de Buenavista Central Elementary School (Timugan)",
      "Mayondon Elementary School",
      "Bayog Elementary School",
      "Lalakay Elementary School",
      "San Jose de Buenavista National High School (Poblacion)",
      "Bernardo F. San Juan National High School",
      "South Hill School (Private)",
      "University of the Philippines Rural High School"
    ],
    "requirements": [],
    "relatedServices": ["scholarship-application"],
    "faqs": [
      {
        "question": "When does enrollment start?",
        "answer": "Enrollment typically begins in July. Please follow the official DepEd page for announcements."
      }
    ],
    "updatedAt": null,
    "sources": [
      {
        "name": "DepEd Schools Division Office List",
        "url": ""
      }
    ]
  },
  {
    "service": "Rural Health Unit (RHU) Locations",
    "slug": "rhu-locations",
    "type": "information",
    "description": "Locations of health centers providing free primary care, immunization, and maternal services.",
    "officeSlug": ["municipal-health-office"],
    "category": {
      "name": "Health & Wellness",
      "slug": "health-wellness"
    },
    "steps": [
      "RHU 1: Main Health Center, Municipal Hall Compound, Brgy. Timugan",
      "RHU 2: Brgy. Batong Malake (Near Barangay Hall)",
      "RHU 3: Brgy. Mayondon (Purok 3)",
      "Animal Bite Center: Municipal Hall Compound"
    ],
    "requirements": [],
    "relatedServices": ["health-certificate"],
    "updatedAt": null,
    "sources": [
      {
        "name": "Municipal Health Office Registry",
        "url": ""
      }
    ]
  }
]
